{
  "toolId": "csv-dedupe",
  "category": "data",
  "ownerTicket": ".scratch/strumentini-expansion-20261005/issues/286-existing-data-200-audit-tranche.md",
  "decision": "ALREADY_COMPLETE",
  "expectedFunctionality": "Elimina righe duplicate usando l'intera riga o le colonne chiave che scegli. Public job: Usa Rimuovi righe duplicate dal CSV.",
  "observedFunctionality": "The current implementation is Gold-certified for the declared narrow job at quality/receipts/table-ops/csv-dedupe.gold.json; executable tests/table-expansion.test.ts coverage exercises the underlying calculation/table behavior and error handling, while quality/receipts/table-ops/browser-acceptance.json verifies the real route interaction/locality contract.",
  "rationale": "No missing behavior required by the current declared public job was found. Broader backlog enhancements remain additive work and are not treated as proof that this existing narrow route is functionally incomplete.",
  "evidence": [
    {
      "kind": "quality-receipt",
      "ref": "quality/receipts/table-ops/csv-dedupe.gold.json",
      "claim": "Tool-specific Gold receipt binds csv-dedupe to exact fixtures, current source identities and functional acceptance."
    },
    {
      "kind": "unit-test",
      "ref": "tests/table-expansion.test.ts",
      "claim": "Executable tests exercise the engine/module behavior used by csv-dedupe, including relevant edge, invalid-input or transformation semantics."
    },
    {
      "kind": "browser-acceptance",
      "ref": "quality/receipts/table-ops/browser-acceptance.json",
      "claim": "Browser acceptance covers the real csv-dedupe route or its explicit functional workflow, including submit/locality and the relevant mobile/preview/handoff behavior."
    },
    {
      "kind": "oracle",
      "ref": "quality/oracles/registry.json",
      "claim": "Canonical oracle registry entry cand-025, referenced by the Gold receipt, is the declared truth authority for csv-dedupe."
    }
  ],
  "childTickets": []
}
