{
  "toolId": "deadline-countdown",
  "category": "date-time",
  "ownerTicket": "legacy-expansion:287",
  "decision": "ALREADY_COMPLETE",
  "expectedFunctionality": "Calcola giorni, ore, minuti e secondi rimanenti oppure già trascorsi rispetto a una scadenza. Public jobs: Usa Quanto manca alla scadenza",
  "observedFunctionality": "The current implementation performs the declared date/time job locally and deterministically: Calcola giorni, ore, minuti e secondi rimanenti oppure già trascorsi rispetto a una scadenza. Tool-specific Gold evidence plus engine/module tests cover boundary/error behavior; browser acceptance covers the real route. Unsupported scope is surfaced rather than silently broadened.",
  "rationale": "No missing behavior required by the current declared public job was found. Broader calendar/live/reference-data backlog work is additive to the explicitly scoped route contract and is not used to manufacture an incomplete audit result.",
  "evidence": [
    {
      "kind": "quality-receipt",
      "ref": "quality/receipts/date-time/deadline-countdown.gold.json",
      "claim": "Tool-specific Gold receipt binds the current deadline-countdown implementation to executable functional fixtures/oracle evidence."
    },
    {
      "kind": "unit-test",
      "ref": "tests/date-time-engine.test.ts",
      "claim": "Date/time family tests exercise the deterministic engine behavior, boundary cases and invalid-input handling used by this tool."
    },
    {
      "kind": "browser-acceptance",
      "ref": "quality/receipts/date-time/browser-acceptance.json",
      "claim": "Real-route browser acceptance exercises submit/keyboard behavior and confirms local task data does not leave the browser."
    }
  ],
  "childTickets": []
}
