{
  "toolId": "domain-frequency-counter",
  "category": "research",
  "ownerTicket": ".scratch/strumentini-expansion-20261005/issues/294-existing-research-200-audit-tranche.md",
  "decision": "ALREADY_COMPLETE",
  "expectedFunctionality": "Mostra quante fonti provengono da ciascun dominio e ordina il risultato per frequenza. Public jobs: Usa Conta le fonti per dominio.",
  "observedFunctionality": "The current implementation has a tool-specific Gold receipt at quality/receipts/research-knowledge/domain-frequency-counter.gold.json; executable unit coverage and real-route browser acceptance cover the declared narrow public job and its error/locality contract.",
  "rationale": "No missing behavior required by the current declared public job was found. Broader backlog enhancements are additive to this narrow route contract and are not used to manufacture an incomplete audit result.",
  "evidence": [
    {
      "kind": "quality-receipt",
      "ref": "quality/receipts/research-knowledge/domain-frequency-counter.gold.json",
      "claim": "Tool-specific Gold receipt binds the current implementation to declared fixtures/oracle evidence and functional acceptance for domain-frequency-counter."
    },
    {
      "kind": "unit-test",
      "ref": "tests/research-knowledge-engine.test.ts",
      "claim": "Executable family tests exercise the engine/module behavior used by domain-frequency-counter, including relevant edge or invalid-input handling."
    },
    {
      "kind": "browser-acceptance",
      "ref": "quality/receipts/research-knowledge/browser-acceptance.json",
      "claim": "Committed browser acceptance includes domain-frequency-counter and verifies a real route submit plus locality/lazy/mobile/accessibility behavior."
    }
  ],
  "childTickets": []
}
