{
  "toolId": "notes-deduplicator",
  "category": "research",
  "ownerTicket": ".scratch/strumentini-expansion-20261005/issues/294-existing-research-200-audit-tranche.md",
  "decision": "ALREADY_COMPLETE",
  "expectedFunctionality": "Elimina note di ricerca duplicate normalizzando spazi e maiuscole/minuscole. Public jobs: Usa Rimuovi note duplicate.",
  "observedFunctionality": "The current implementation has a tool-specific Gold receipt at quality/receipts/research-knowledge/notes-deduplicator.gold.json; executable unit coverage and real-route browser acceptance cover the declared narrow public job and its error/locality contract.",
  "rationale": "No missing behavior required by the current declared public job was found. Broader backlog enhancements are additive to this narrow route contract and are not used to manufacture an incomplete audit result.",
  "evidence": [
    {
      "kind": "quality-receipt",
      "ref": "quality/receipts/research-knowledge/notes-deduplicator.gold.json",
      "claim": "Tool-specific Gold receipt binds the current implementation to declared fixtures/oracle evidence and functional acceptance for notes-deduplicator."
    },
    {
      "kind": "unit-test",
      "ref": "tests/research-knowledge-engine.test.ts",
      "claim": "Executable family tests exercise the engine/module behavior used by notes-deduplicator, including relevant edge or invalid-input handling."
    },
    {
      "kind": "browser-acceptance",
      "ref": "quality/receipts/research-knowledge/browser-acceptance.json",
      "claim": "Committed browser acceptance includes notes-deduplicator and verifies a real route submit plus locality/lazy/mobile/accessibility behavior."
    }
  ],
  "childTickets": []
}
