{
  "toolId": "image-metadata-viewer",
  "category": "files-assets",
  "ownerTicket": ".scratch/strumentini-expansion-20261005/issues/291-existing-files-assets-200-audit-tranche.md",
  "decision": "ALREADY_COMPLETE",
  "expectedFunctionality": "Mostra tipo, dimensioni, firma e peso di un'immagine locale senza caricarla online. Public jobs: Usa Vedi informazioni di un'immagine",
  "observedFunctionality": "The current public summary explicitly promises type, dimensions, signature and byte size; the bounded metadata inspector returns exactly those facts. Ticket 315 concerns richer EXIF-class views, not a missing field from this declared job.",
  "rationale": "No missing behavior required by the current declared public job was found. Existing image-expansion tickets are treated as additive only where they broaden controls, formats, previews or packaging beyond the present truthful route contract; they are not used to manufacture a false incomplete result.",
  "evidence": [
    {
      "kind": "quality-receipt",
      "ref": "quality/receipts/expanded-local/image-metadata-viewer.gold.json",
      "claim": "Tool-specific Gold receipt binds image-metadata-viewer to the current declared local image semantics and fixture/oracle frontier."
    },
    {
      "kind": "browser-acceptance",
      "ref": "quality/receipts/expanded-local/browser-acceptance.json",
      "claim": "Real-route expanded-local acceptance includes image-metadata-viewer with a tool-specific output assertion/hash plus locality, lazy-load, 390px and accessibility checks."
    },
    {
      "kind": "source-contract",
      "ref": "src/engines/image/visual-tools.ts",
      "claim": "Shared image operations implement bounded input validation, local decoding/processing and verified output or deterministic inspection semantics used by this route."
    }
  ],
  "childTickets": []
}
