{
  "toolId": "citation-key-generator",
  "category": "research",
  "ownerTicket": "legacy-expansion:294",
  "decision": "ALREADY_COMPLETE",
  "expectedFunctionality": "Genera chiavi stabili autore-anno-titolo per BibTeX e gestisce automaticamente i duplicati. Public jobs: Usa Crea chiavi per citazioni.",
  "observedFunctionality": "The current implementation has a tool-specific Gold receipt at quality/receipts/research-knowledge/citation-key-generator.gold.json; executable unit coverage and real-route browser acceptance cover the declared narrow public job and its error/locality contract.",
  "rationale": "No missing behavior required by the current declared public job was found. Broader backlog enhancements are additive to this narrow route contract and are not used to manufacture an incomplete audit result.",
  "evidence": [
    {
      "kind": "quality-receipt",
      "ref": "quality/receipts/research-knowledge/citation-key-generator.gold.json",
      "claim": "Tool-specific Gold receipt binds the current implementation to declared fixtures/oracle evidence and functional acceptance for citation-key-generator."
    },
    {
      "kind": "unit-test",
      "ref": "tests/research-knowledge-engine.test.ts",
      "claim": "Executable family tests exercise the engine/module behavior used by citation-key-generator, including relevant edge or invalid-input handling."
    },
    {
      "kind": "browser-acceptance",
      "ref": "quality/receipts/research-knowledge/browser-acceptance.json",
      "claim": "Committed browser acceptance includes citation-key-generator and verifies a real route submit plus locality/lazy/mobile/accessibility behavior."
    }
  ],
  "childTickets": []
}
