{
  "toolId": "percentage-helper",
  "category": "business-math",
  "ownerTicket": "legacy-expansion:284",
  "decision": "ALREADY_COMPLETE",
  "expectedFunctionality": "Aggiunge una percentuale a un importo oppure ricava il netto da un totale che la include già. Public job: Usa Calcola IVA e percentuali.",
  "observedFunctionality": "The current implementation is Gold-certified for the declared narrow job at quality/receipts/business-math/percentage-helper.gold.json; executable tests/business-tools.test.ts coverage exercises the underlying calculation/table behavior and error handling, while quality/receipts/business-math/browser-acceptance.json verifies the real route interaction/locality contract.",
  "rationale": "No missing behavior required by the current declared public job was found. Broader backlog enhancements remain additive work and are not treated as proof that this existing narrow route is functionally incomplete.",
  "evidence": [
    {
      "kind": "quality-receipt",
      "ref": "quality/receipts/business-math/percentage-helper.gold.json",
      "claim": "Tool-specific Gold receipt binds percentage-helper to exact fixtures, current source identities and functional acceptance."
    },
    {
      "kind": "unit-test",
      "ref": "tests/business-tools.test.ts",
      "claim": "Executable tests exercise the engine/module behavior used by percentage-helper, including relevant edge, invalid-input or transformation semantics."
    },
    {
      "kind": "browser-acceptance",
      "ref": "quality/receipts/business-math/browser-acceptance.json",
      "claim": "Browser acceptance covers the real percentage-helper route or its explicit functional workflow, including submit/locality and the relevant mobile/preview/handoff behavior."
    },
    {
      "kind": "oracle",
      "ref": "quality/oracles/registry.json",
      "claim": "Canonical oracle registry entry cand-119, referenced by the Gold receipt, is the declared truth authority for percentage-helper."
    }
  ],
  "childTickets": []
}
